{
  "schema_version": "1.0",
  "record_type": "rollback_receipt",
  "tenant_id": "018f0000-0000-7000-8000-000000000001",
  "receipt_id": "018f0000-0000-7000-8000-000000000029",
  "issuer_role": "runtime_authority",
  "target_scope": {
    "schema_version": "1.0",
    "record_type": "memory_scope",
    "scope_id": "018f0000-0000-7000-8000-000000000005",
    "tenant_id": "018f0000-0000-7000-8000-000000000001",
    "actor_id": "018f0000-0000-7000-8000-000000000002",
    "parent_record_type": "actor_context",
    "parent_digest": "sha256:eaa0f1c67d60a24074f87d824ec6267bf04ca492ff330844c17ee715e4fa08df",
    "selection": {
      "level": "project",
      "project_id": "018f0000-0000-7000-8000-00000000002e"
    },
    "derived_at": "2026-01-01T00:00:02.000Z",
    "valid_until": "2026-01-01T01:00:00.000Z"
  },
  "activation_receipt_ref": {
    "record_type": "activation_receipt",
    "record_id": "018f0000-0000-7000-8000-000000000028",
    "record_digest": "sha256:f46f765a41d1a43f00141084f3b50d3b478fb0961f274d2fc750c5e2858a2980"
  },
  "artifact_type": "skill",
  "artifact_id": "018f0000-0000-7000-8000-000000000023",
  "artifact_revision": 1,
  "artifact_digest": "sha256:be4c49fbd64577c93908f9c49d3a4625e52c216bac4703be737fc2e080f4c9a7",
  "rollback_revision": {
    "record_type": "skill_proposal",
    "record_id": "018f0000-0000-7000-8000-00000000002a",
    "record_digest": "sha256:e1e992a0e0da338127efa46affc6a1e27a796a51f2ed83dbbc635069caf08d3a"
  },
  "restored_revision_ref": null,
  "evidence_refs": [
    {
      "record_type": "evidence_envelope",
      "record_id": "018f0000-0000-7000-8000-000000000008",
      "record_digest": "sha256:b0ed74d7d98366b73169d55ad68dc9db4fbc626f2e58e6c1b8668bc7fda38a81"
    }
  ],
  "provenance_digest": "sha256:c3d6ada6e682fbfae28b0b9eb9f87c45f84627736f9c05dc828337161abb1a26",
  "producer_version": "runtime.authority.v1",
  "runtime_version": "runtime.v1",
  "status": "rolled_back",
  "reason_code": "fixture.rollback",
  "policy_refs": [
    {
      "record_type": "policy_proposal",
      "record_id": "018f0000-0000-7000-8000-00000000005a",
      "record_digest": "sha256:0a2e5f05be4f91c4ce301cd0d57ea112eed02bb71bad73c69f34ce3e7ca38f9c"
    }
  ],
  "reviewer_refs": [
    {
      "record_type": "approval_record",
      "record_id": "018f0000-0000-7000-8000-000000000017",
      "record_digest": "sha256:12bed50694285a872224ca05220a0df245559ca5898a753a0a0a5e933bd283cb"
    }
  ],
  "compatibility": {
    "contract_versions": [
      "rollback_receipt=1.0",
      "activation_receipt=1.0"
    ],
    "runtime_version_range": ">=1.0"
  },
  "idempotency": {
    "tenant_id": "018f0000-0000-7000-8000-000000000001",
    "idempotency_key": "fixture.operation.0013",
    "operation_digest": "sha256:701218a925867d2be5425d5e359481b6a4d8bf23b142c191b215b3b048bcc8c4"
  },
  "issued_at": "2026-01-01T00:25:00.000Z",
  "expires_at": "2026-01-02T00:25:00.000Z",
  "receipt_digest": "sha256:955232cd5940d6ba9711d76d058f245cd1ee981a671eaf37b273b2f42ad4213e",
  "proof": {
    "issuer": "runtime.authority",
    "key_id": "runtime.key.v1",
    "algorithm": "fixture-proof-v1",
    "proof_domain": "rollback_receipt.v1",
    "object_digest": "sha256:955232cd5940d6ba9711d76d058f245cd1ee981a671eaf37b273b2f42ad4213e",
    "nonce": "NNNNNNNNNNNNNNNNNNNNNN",
    "detached_proof": "PPPPPPPPPPPPPPPPPPPPPPPPPPPPPPPPPPPPPPPPPPP"
  }
}
